{
  "$schema": "./05_IMPLEMENTATION_PROMPTS.schema.json",
  "schemaVersion": "1.0.0",
  "packId": "map-explorer-premium-redesign-2026-06-05",
  "title": "Map Explorer Premium Redesign Implementation Prompts",
  "sourceMarkdown": "05_IMPLEMENTATION_PROMPTS.md",
  "statusVocabulary": [
    "pending",
    "in_progress",
    "implemented",
    "blocked",
    "verified",
    "deferred"
  ],
  "prompts": [
    {
      "id": "prompt-00",
      "number": 0,
      "title": "Baseline Surface Inventory",
      "status": "implemented",
      "objective": "Create a precise inventory of every Map Explorer surface affected by the redesign before behavior changes.",
      "read": [
        "00_SCOPE_AND_GUARDRAILS.md",
        "06_QA_AND_REGRESSION_GATES.md",
        "docs/architecture/map-explorer-canonical-surface.md"
      ],
      "tasks": [
        "Inventory modal, left panel, right dock, bottom panel, toolbar, status bar, floating tool, drawer, dialog, and canvas overlay entry points.",
        "Record all current `bottomPanelOpen`, `activeBottomPanelTab`, `MapBottomPanel`, `MapPanelRail side=\"bottom\"`, `MapLayerPanelPlacement`, `MapBottomPanelTabId`, and `targetSlot: \"bottom-panel\"` usages.",
        "Identify current routes from toolbar, status bar, activity rail, command palette, and cockpit actions.",
        "Update or add a surface-inventory test that fails if a new bottom workspace route is introduced during the redesign."
      ],
      "acceptance": [
        "No behavior changes.",
        "All current bottom-panel and floating-tool entry points are named.",
        "The ledger contains the inventory summary and known high-risk files."
      ],
      "validation": {
        "commands": [
          "npm run typecheck",
          "npm run lint:errors",
          "npm run test -- src/centerpanel/components/map/__tests__/mapSurfaceInventory.test.ts src/centerpanel/components/map/__tests__/mapNavigationModel.test.ts"
        ]
      }
    },
    {
      "id": "prompt-01",
      "number": 1,
      "title": "Visual Baseline And Screenshot Harness",
      "status": "implemented",
      "objective": "Capture the current failing visual states so the redesign can prove it fixed the actual screenshots.",
      "read": [
        "06_QA_AND_REGRESSION_GATES.md",
        "04_VISUAL_INTERACTION_SYSTEM.md"
      ],
      "tasks": [
        "Add or update Playwright checks for `IMG-01` through `IMG-04`.",
        "Capture opening modal, left Data/Layers panels, bottom Diagnostics, floating Draw/Measure, top toolbar, and status bar.",
        "Cover desktop, short desktop, tablet, and narrow compositions where feasible.",
        "Keep the test names tied to `UX-01` through `UX-06`."
      ],
      "acceptance": [
        "Baseline screenshots or visual assertions exist before UI changes.",
        "The baseline identifies the current bottom panel and floating tool states.",
        "No production behavior changes."
      ],
      "validation": {
        "commands": [
          "npm run typecheck",
          "npm run lint:errors",
          "npm run test -- src/centerpanel/components/map"
        ]
      }
    },
    {
      "id": "prompt-02",
      "number": 2,
      "title": "Launch Dialog State Boundary",
      "status": "implemented",
      "objective": "Separate launch/readiness dialog state from left-panel state and workspace tab state.",
      "read": [
        "01_OPENING_MODAL_SPEC.md",
        "02_PANEL_ARCHITECTURE_SPEC.md"
      ],
      "tasks": [
        "Define `MapStartDialogReason` and launch dialog state.",
        "Ensure dismissal, close, `Esc`, continue, import, project load, and demo pack handoff are deterministic.",
        "Add migration/normalization for old cockpit or launch flags if any are persisted.",
        "Keep derived readiness metrics computed from selectors, not persisted."
      ],
      "acceptance": [
        "Launch dialog state cannot be confused with left-panel tab state.",
        "Dismissal does not cause repeated reopen loops.",
        "Existing map open/close and keyboard launch paths still work."
      ],
      "validation": {
        "commands": [
          "npm run typecheck",
          "npm run lint:errors",
          "npm run test -- src/centerpanel/components/map"
        ]
      }
    },
    {
      "id": "prompt-03",
      "number": 3,
      "title": "Start Dialog Visual Redesign",
      "status": "implemented",
      "objective": "Build the premium opening dialog as a dedicated component.",
      "read": [
        "01_OPENING_MODAL_SPEC.md",
        "04_VISUAL_INTERACTION_SYSTEM.md"
      ],
      "tasks": [
        "Add `MapStartDialog` or equivalent with scoped CSS Module.",
        "Implement header band, primary decision row, readiness strip, context preview, and optional advanced disclosure.",
        "Keep one scroll root at most.",
        "Wire import, open project, demo pack, and continue actions to existing callbacks.",
        "Preserve focus trap, close, `Esc`, aria labels, and focus return."
      ],
      "acceptance": [
        "`UX-01` is visually resolved.",
        "Primary actions are visible at desktop and short desktop viewports.",
        "Unknown/demo/sample/readiness state remains truthful."
      ],
      "validation": {
        "commands": [
          "npm run typecheck",
          "npm run lint:errors",
          "npm run test -- src/centerpanel/components/map"
        ]
      },
      "uxIds": [
        "UX-01"
      ]
    },
    {
      "id": "prompt-04",
      "number": 4,
      "title": "Left Panel Launch Decoupling",
      "status": "implemented",
      "objective": "Remove full launch/readiness modal content from all left-panel render paths.",
      "read": [
        "01_OPENING_MODAL_SPEC.md",
        "02_PANEL_ARCHITECTURE_SPEC.md"
      ],
      "tasks": [
        "Split `MapWorkspaceCockpit` into modal-only content and compact in-workspace summary if needed.",
        "Ensure the left panel cannot render `MapStartDialog` or its full body.",
        "Keep a compact Overview/Readiness summary only if it fits the left-panel contract.",
        "Update tests for left-panel launch-content absence."
      ],
      "acceptance": [
        "The launch-modal part of `UX-02` is resolved.",
        "Left-panel Overview/Readiness is compact and not a disguised modal.",
        "No import/demo/load/continue callback is lost."
      ],
      "validation": {
        "commands": [
          "npm run typecheck",
          "npm run lint:errors",
          "npm run test -- src/centerpanel/components/map"
        ]
      },
      "uxIds": [
        "UX-02"
      ]
    },
    {
      "id": "prompt-05",
      "number": 5,
      "title": "Docking Type Contract Without Bottom Placement",
      "status": "implemented",
      "objective": "Make bottom workspace placement structurally impossible in the docking model.",
      "read": [
        "02_PANEL_ARCHITECTURE_SPEC.md",
        "03_TOP_AND_STATUS_BAR_SPEC.md"
      ],
      "tasks": [
        "Remove active `\"bottom\"` from `MapLayerPanelPlacement`.",
        "Ensure `getMapDockLayout` never returns a bottom workspace placement.",
        "Replace compact-width behavior with side drawer or collapsed side-panel rules.",
        "Expand `MapRightDockPanel` with the target right-dock IDs.",
        "Update `map-docking.test.ts` to assert no bottom placement at desktop, short desktop, tablet, and narrow widths."
      ],
      "acceptance": [
        "`getMapDockLayout` cannot return a bottom workspace.",
        "Compact widths do not create bottom drawers.",
        "Existing right dock panels still open."
      ],
      "validation": {
        "commands": [
          "npm run typecheck",
          "npm run test -- src/centerpanel/components/map/__tests__/map-docking.test.ts"
        ]
      },
      "uxIds": [
        "UX-03"
      ]
    },
    {
      "id": "prompt-06",
      "number": 6,
      "title": "Right Dock State And Route Model",
      "status": "implemented",
      "objective": "Create a single typed route model for right-dock panels and migrated bottom surfaces.",
      "read": [
        "02_PANEL_ARCHITECTURE_SPEC.md",
        "03_TOP_AND_STATUS_BAR_SPEC.md"
      ],
      "tasks": [
        "Add right-dock IDs for `inspect`, `attributes`, `problems`, `timeline`, `tasks`, `diagnostics`, `selection`, `qa`, `performance`, and `collaboration`.",
        "Define route helpers from old bottom tabs to new right dock panels.",
        "Add typed open/close/switch helpers, preserving focus return where current bottom-panel actions do.",
        "Keep local UI state serializable where persistence is useful."
      ],
      "acceptance": [
        "Every old bottom tab has an explicit right-dock target.",
        "Toolbar/status/activity callbacks can use one right-dock route helper.",
        "No route uses stringly typed ad hoc panel IDs outside the helper."
      ],
      "validation": {
        "commands": [
          "npm run typecheck",
          "npm run lint:errors",
          "npm run test -- src/centerpanel/components/map"
        ]
      },
      "uxIds": [
        "UX-03"
      ]
    },
    {
      "id": "prompt-07",
      "number": 7,
      "title": "Right Dock Host Visual Shell",
      "status": "implemented",
      "objective": "Add or evolve a premium right inspector dock host before migrating content into it.",
      "read": [
        "02_PANEL_ARCHITECTURE_SPEC.md",
        "04_VISUAL_INTERACTION_SYSTEM.md"
      ],
      "tasks": [
        "Create a shared right dock host/header/tab pattern.",
        "Support active panel title, state label, close/collapse, overflow menu, and body scroll.",
        "Implement desktop dock and constrained-width side-drawer behavior.",
        "Keep only one primary right dock active at a time."
      ],
      "acceptance": [
        "Right dock can host empty/placeholder-free shell states for all migrated panel IDs.",